{
  "name": "Professional continuing education",
  "description": "Certification and continuing-education for practising professionals (clinicians, engineers, accountants). Rigorous, standards-bound, often for credit hours.",
  "reading_level": "adult",
  "tone": "authoritative, evidence-based; assume expertise, respect the learner's time",
  "session": {
    "minutes": 45,
    "notes": "A CE unit; may map to credit hours. Self-paced."
  },
  "guide_role": "none",
  "age_bands": [
    "adult"
  ],
  "assessment_style": "Graded against a standard or competency framework; often a proctored or recorded pass for the credential. Rubric-based.",
  "delivery_media": [
    "screen",
    "print"
  ],
  "privacy": {
    "minors": false,
    "visibility_default": "shared",
    "consent_notes": "Adult professionals; ground claims in the governing standard (source_only/source_first)."
  },
  "language_note": "Professional register of the field; use the standard's own terminology and cite it.",
  "supports": [
    "visual_structure"
  ],
  "defaults_for": {
    "MP-11": {
      "size": "program",
      "unit": "hours"
    },
    "MP-02": {
      "size": "full",
      "depth": "advanced"
    },
    "MP-04": {
      "sections_max": 6
    }
  },
  "what_if_wrong": {
    "reading_level": "Too high: a learner cannot decode the text and disengages; too low: an adult feels patronised. A LEARNER profile's reading_level always overrides this default.",
    "tone": "A mismatched tone (jokey for a compliance course, stern for a child) breaks trust. INPUT/SOURCE tone wins over this default.",
    "session": "Sessions longer than the real attention window lose the learner near the end; too short and a topic never resolves. MP-11 uses this as the lesson time unit; an explicit duration in the brief overrides it.",
    "guide_role": "Assuming an adult is present when none is (or the reverse) makes instructions unusable. If LEARNER says otherwise, LEARNER wins.",
    "assessment_style": "A high-stakes graded style on a low-stakes context (or vice versa) distorts pace and anxiety. Named exams in the brief override this.",
    "delivery_media": "Assuming a screen where there is none (or bandwidth that is not there) makes content undeliverable. A modifier (offline-first, low-bandwidth) narrows this further.",
    "privacy": "Treating a minor context as adult can publish a child's data; the floor is pending_review for minors and visibility is never relaxed below the profile's default.",
    "language_note": "Ignoring the dominant language or a second-language audience produces text no one here can read. LEARNER.languages[0] wins."
  },
  "schema": "metadax.context-profile/0.3",
  "id": "professional-continuing-education"
}
